{
	"$schema": "https://json-schema.org/draft/2020-12/schema",
	"$id": "https://github.com/pimmink/gsd-pi/blob/main/docs/work-register.schema.json",
	"title": "GSD Pi contributor work register",
	"type": "object",
	"required": [
		"schemaVersion",
		"repository",
		"evidenceAsOf",
		"statusVocabulary",
		"items"
	],
	"properties": {
		"$schema": { "type": "string", "minLength": 1 },
		"schemaVersion": { "const": 1 },
		"repository": {
			"type": "object",
			"required": ["upstream", "fork", "defaultBase"],
			"properties": {
				"upstream": { "type": "string", "minLength": 1 },
				"fork": { "type": "string", "minLength": 1 },
				"defaultBase": { "type": "string", "minLength": 1 }
			},
			"additionalProperties": false
		},
		"evidenceAsOf": { "type": "string", "format": "date" },
		"statusVocabulary": {
			"type": "array",
			"uniqueItems": true,
			"items": { "type": "string", "minLength": 1 }
		},
		"items": {
			"type": "array",
			"items": {
				"type": "object",
				"required": [
					"id",
					"type",
					"scope",
					"upstreamDisposition",
					"title",
					"status",
					"issues",
					"pullRequests",
					"branches",
					"commits",
					"context",
					"validation",
					"nextAction"
				],
				"properties": {
					"id": { "type": "string", "pattern": "^GSD-W[0-9]{3}$" },
					"type": { "type": "string", "minLength": 1 },
					"scope": { "enum": ["upstream", "fork-local"] },
					"upstreamDisposition": {
						"enum": ["pr-required", "no-pr-planned", "historical"]
					},
					"title": { "type": "string", "minLength": 1 },
					"status": { "type": "string", "minLength": 1 },
					"issues": {
						"type": "array",
						"uniqueItems": true,
						"items": { "type": "integer", "minimum": 1 }
					},
					"pullRequests": {
						"type": "array",
						"uniqueItems": true,
						"items": { "type": "integer", "minimum": 1 }
					},
					"relatedRefs": {
						"type": "array",
						"uniqueItems": true,
						"items": { "type": "string", "minLength": 1 }
					},
					"planRefs": {
						"type": "array",
						"uniqueItems": true,
						"description": "Stable identifiers of local planning artifacts. These are memory and traceability references, not authoritative status or evidence.",
						"items": { "type": "string", "pattern": "^PLAN-[A-Z0-9-]+$" }
					},
					"branches": {
						"type": "array",
						"uniqueItems": true,
						"items": { "type": "string", "minLength": 1 }
					},
					"commits": {
						"type": "array",
						"uniqueItems": true,
						"items": { "type": "string", "pattern": "^[0-9a-f]{7,40}$" }
					},
					"context": { "type": "string", "minLength": 1 },
					"validation": { "type": "string", "minLength": 1 },
					"nextAction": { "type": "string", "minLength": 1 },
					"localExtensionPatchRef": {
						"type": "string",
						"minLength": 1,
						"description": "extensionId of a localExtensionPatches[] entry that reimplements this item's user-facing behavior as a temporary local community extension."
					}
				},
				"additionalProperties": false
			}
		},
		"localExtensionPatches": {
			"type": "array",
			"description": "Temporary local gsd-pi community extensions (in ~/.gsd/agent/extensions/ or .gsd/extensions/) that reimplement not-yet-merged PR behavior for personal/team use. Never part of any PR branch.",
			"items": {
				"type": "object",
				"required": [
					"extensionId",
					"path",
					"scope",
					"relatedWorkItems",
					"reimplementation",
					"branchHeadsAtLastSync",
					"syncPolicy",
					"retireWhen",
					"status"
				],
				"properties": {
					"extensionId": { "type": "string", "minLength": 1 },
					"path": { "type": "string", "minLength": 1 },
					"scope": { "enum": ["global", "project-local"] },
					"installedAt": { "type": "string", "format": "date" },
					"relatedWorkItems": {
						"type": "array",
						"uniqueItems": true,
						"items": { "type": "string", "pattern": "^GSD-W[0-9]{3}$" }
					},
					"reimplementation": { "type": "boolean" },
					"reimplementationNote": { "type": "string", "minLength": 1 },
					"installedProjects": {
						"type": "array",
						"uniqueItems": true,
						"items": { "type": "string", "minLength": 1 }
					},
					"knownIssue": { "type": "string", "minLength": 1 },
					"branchHeadsAtLastSync": {
						"type": "object",
						"additionalProperties": {
							"type": "string",
							"pattern": "^[0-9a-f]{7,40}$"
						}
					},
					"syncPolicy": { "type": "string", "minLength": 1 },
					"retireWhen": { "type": "string", "minLength": 1 },
					"status": { "enum": ["active", "retired"] }
				},
				"additionalProperties": false
			}
		}
	},
	"additionalProperties": false
}
