{
	"$schema": "./work-register.schema.json",
	"schemaVersion": 1,
	"repository": {
		"upstream": "open-gsd/gsd-pi",
		"fork": "pimmink/gsd-pi",
		"defaultBase": "upstream/main"
	},
	"evidenceAsOf": "2026-10-13",
	"statusVocabulary": [
		"idea",
		"investigating",
		"in-progress",
		"complete",
		"pr-open",
		"merged",
		"closed-unmerged",
		"superseded",
		"blocked"
	],
	"items": [
		{
			"id": "GSD-W001",
			"type": "bugfix",
			"scope": "upstream",
			"upstreamDisposition": "historical",
			"title": "Extension registry lockSync ESYNC failure",
			"status": "merged",
			"issues": [
				1598
			],
			"pullRequests": [],
			"branches": [],
			"commits": [],
			"context": "gsd extensions used the synchronous proper-lockfile API with an unsupported retries option in v1.12.0.",
			"validation": "Upstream issue is closed; no contributor PR is recorded in this fork register.",
			"nextAction": "None unless the regression reappears."
		},
		{
			"id": "GSD-W002",
			"type": "bugfix",
			"scope": "upstream",
			"upstreamDisposition": "pr-required",
			"title": "Markdown renderer output must satisfy markdownlint",
			"status": "merged",
			"issues": [
				1600
			],
			"pullRequests": [
				1610
			],
			"branches": [
				"fix/markdownlint-table-separators"
			],
			"commits": [
				"e7b6f291ac680f1b00fe1cb6ca246b8cbcac3aac"
			],
			"context": "Generated markdown contained invalid heading, spacing, and table separator forms including MD055, MD056, and MD060 failures.",
			"validation": "PR #1610 is state MERGED (2026-08-16T23:44:17Z) at merge commit e7b6f291ac680f1b00fe1cb6ca246b8cbcac3aac; the merge is contained in current upstream/main (09ae3c22).",
			"nextAction": "None; contribution merged upstream."
		},
		{
			"id": "GSD-W003",
			"type": "bugfix",
			"scope": "upstream",
			"upstreamDisposition": "historical",
			"title": "Milestone status exposes persisted dependencies",
			"status": "merged",
			"issues": [
				1601
			],
			"pullRequests": [],
			"branches": [],
			"commits": [],
			"context": "gsd_milestone_status omitted persisted dependsOn data, preventing authoritative dependency verification through the database tool.",
			"validation": "Upstream issue is closed and current gsd_milestone_status returns dependsOn.",
			"nextAction": "Keep contract coverage when milestone status evolves."
		},
		{
			"id": "GSD-W004",
			"type": "bugfix",
			"scope": "upstream",
			"upstreamDisposition": "historical",
			"title": "Legacy migration consistency for completed slices and structured decisions",
			"status": "merged",
			"issues": [
				1606,
				1607
			],
			"pullRequests": [
				1611
			],
			"branches": [
				"fix/migrate-slice-decision-consistency"
			],
			"commits": [
				"8d1d2067b1ec5b0b06e8772033b6f6f848b7613d"
			],
			"context": "Legacy migration could produce completed slices with pending tasks and lose structured decision semantics through title-only extraction.",
			"validation": "PR #1611 merged upstream.",
			"nextAction": "Retain migration corpus regression coverage."
		},
		{
			"id": "GSD-W005",
			"type": "feature",
			"scope": "upstream",
			"upstreamDisposition": "historical",
			"title": "Canonical requirement and decision read tools",
			"status": "closed-unmerged",
			"issues": [
				1608
			],
			"pullRequests": [
				1613,
				1682
			],
			"branches": [
				"feat/canonical-read-tools",
				"pr-1613"
			],
			"commits": [
				"af34c4e4",
				"8eeed156"
			],
			"context": "Added canonical requirement and decision list/get tools and addressed adversarial review findings. The original and follow-up PRs were closed without merge; related behavior later appeared in the v1.15 line and generated three follow-up correctness issues.",
			"validation": "PR #1613 and PR #1682 are closed without merge. Follow-up issues #1727-#1729 remain tracked separately.",
			"nextAction": "Use the active canonical-read follow-up PRs as the current authority."
		},
		{
			"id": "GSD-W006",
			"type": "bugfix",
			"scope": "upstream",
			"upstreamDisposition": "historical",
			"title": "Claude Sonnet 5 routing catalog and Copilot startup fallback",
			"status": "merged",
			"issues": [
				1612
			],
			"pullRequests": [
				1609,
				1703,
				1705
			],
			"branches": [
				"fix/model-router-sonnet5-catalog",
				"fix/copilot-sonnet5-startup-fallback"
			],
			"commits": [
				"409ea8543bc6807b17b49317c117e8c846b1d1bf",
				"42cb8ec346e06cd41b51c69acccb9e91d3a9290f",
				"795b4b3df76ca15f91834e6d11c749c179d8ce18"
			],
			"context": "Registered claude-sonnet-5 in routing capability, cost, and profile tables and added graceful Copilot fallback when the preferred model is temporarily unavailable.",
			"validation": "PRs #1609, #1703, and #1705 merged upstream.",
			"nextAction": "Guard against duplicate registry rows and invalid provider aliases."
		},
		{
			"id": "GSD-W007",
			"type": "bugfix",
			"scope": "upstream",
			"upstreamDisposition": "pr-required",
			"title": "Package-manager-aware verification commands and bootstrap recovery",
			"status": "merged",
			"issues": [],
			"pullRequests": [
				1706
			],
			"branches": [
				"fix/verification-gate-package-manager"
			],
			"commits": [
				"a4c63862",
				"65b77ec8",
				"d9ddb5a0",
				"8b986a9b2953ee56467194bb9b2fa62d2246542e",
				"85b334d4c0d77fe8c88ec5e000966f4ca8ba7092"
			],
			"context": "Centralizes npm, pnpm, yarn, and bun command construction. Follow-up commit 8b986a9b restores stale shim backups after interrupted bootstrap runs and writes new backups atomically.",
			"validation": "PR #1706 is state MERGED (2026-08-16T23:38:38Z) at merge commit 85b334d4c0d77fe8c88ec5e000966f4ca8ba7092; the merge is contained in current upstream/main (09ae3c22).",
			"nextAction": "None; contribution merged upstream."
		},
		{
			"id": "GSD-W008",
			"type": "bugfix",
			"scope": "upstream",
			"upstreamDisposition": "pr-required",
			"title": "Isolate canonical reads from the global workflow database handle",
			"status": "merged",
			"issues": [
				1727
			],
			"pullRequests": [
				1731
			],
			"branches": [
				"fix/canonical-read-db-isolation"
			],
			"commits": [
				"31af02a7",
				"e329a411",
				"10aa03954444e51390160f00a1d97a59d4a8604f"
			],
			"context": "Routes canonical native and MCP reads through isolated per-project adapters to prevent implicit database creation and global handle mutation.",
			"validation": "PR #1731 is state MERGED (2026-08-14T13:01:34Z) at merge commit 10aa03954444e51390160f00a1d97a59d4a8604f; the merge is contained in current upstream/main (09ae3c22).",
			"nextAction": "None; contribution merged upstream."
		},
		{
			"id": "GSD-W009",
			"type": "bugfix",
			"scope": "upstream",
			"upstreamDisposition": "pr-required",
			"title": "Apply canonical list predicates before SQL limit",
			"status": "merged",
			"issues": [
				1728
			],
			"pullRequests": [
				1732
			],
			"branches": [
				"fix/canonical-sql-predicates"
			],
			"commits": [
				"27167552",
				"da908349835815274d2b2d097da50880d3c44f33"
			],
			"context": "Moves requirement class filtering and decision tombstone exclusion into SQL before LIMIT to prevent under-returning and deleted decision leakage.",
			"validation": "PR #1732 is state MERGED (2026-08-16T23:38:38Z) at merge commit da908349835815274d2b2d097da50880d3c44f33; the merge is contained in current upstream/main (09ae3c22).",
			"nextAction": "None; contribution merged upstream."
		},
		{
			"id": "GSD-W010",
			"type": "bugfix",
			"scope": "upstream",
			"upstreamDisposition": "pr-required",
			"title": "Canonical read error parity between native and MCP surfaces",
			"status": "merged",
			"issues": [
				1729
			],
			"pullRequests": [
				1734
			],
			"branches": [
				"fix/canonical-read-error-parity"
			],
			"commits": [
				"c4e6aa75",
				"c547bc73",
				"e728a95714c7fa78cb2f41c91d978a93e6e56a5f"
			],
			"context": "Centralizes db_unavailable, not_found, and query_error semantics and replaces simulated tests with behavioral native-versus-MCP fixtures.",
			"validation": "PR #1734 is state MERGED (2026-08-16T23:31:55Z) at merge commit e728a95714c7fa78cb2f41c91d978a93e6e56a5f; the merge is contained in current upstream/main (09ae3c22).",
			"nextAction": "None; contribution merged upstream."
		},
		{
			"id": "GSD-W011",
			"type": "feature",
			"scope": "upstream",
			"upstreamDisposition": "historical",
			"title": "MAI Code 1.1 Flash support for GitHub Copilot routing",
			"status": "merged",
			"issues": [],
			"pullRequests": [
				1758
			],
			"relatedRefs": [
				"pimmink/gsd-pi#1",
				"open-gsd/gsd-pi#1758"
			],
			"branches": [
				"main",
				"feat/mai-code-1-1-flash-copilot",
				"fix/mai-cost-table-provider-section"
			],
			"commits": [
				"ef6ec9cd",
				"5a96d62d",
				"47461c6065b116e1320bf7aeef912af8bc77a017",
				"8362b8c9",
				"babffb04251d04a70f03ab1cafbe2cb6cb3f8c75",
				"c4f785534924f55eb644c451e8668969a875ab1c"
			],
			"context": "Adds MAI Code 1.1 Flash catalog generation, generated model entries, routing cost/profile coverage, and review fixes. Fork PR pimmink/gsd-pi#1 was squash-merged into fork main; upstream PR #1758 was opened from fork main. Recovery branch recovery/pre-fork-model-routing-20260813 preserves earlier provider behavior tests from commit 788ef306 for assessment.",
			"validation": "Upstream PR #1758 is state MERGED as of 2026-08-15 at head c4f78553 (fork main). All CI checks (fast-gates, build, node22-smoke, ci-gate, GitGuardian, Socket) report SUCCESS; windows-portability SKIPPED. The earlier build/ci-gate failure from the headless-auto provider-error pause E2E test was resolved before merge. As of 2026-08-18 the MAI Code 1.1 Flash cost table is present upstream and fork main was fast-forwarded to upstream/main (09ae3c22).",